{
  "person": "บุคคลเบื้องหลังผลงาน",
  "profile": "ทำความรู้จักเส้นทางของฉันในฐานะวิศวกรซอฟต์แวร์ สำรวจโปรเจกต์ ประสบการณ์ และการตัดสินใจทางเทคนิคเบื้องหลังผลงาน ผ่านบทสนทนาโต้ตอบกับ AI",
  "explore": "สำรวจผ่านการสนทนา",
  "nav": ["ประสบการณ์", "โปรเจกต์", "ทักษะและเครื่องมือ", "ติดต่อ"],
  "navQuestions": [
    "เล่าเกี่ยวกับประสบการณ์ของคุณให้ฟังหน่อย",
    "เล่าเกี่ยวกับโปรเจกต์ของคุณให้ฟังหน่อย",
    "เล่าเกี่ยวกับทักษะและเครื่องมือของคุณให้ฟังหน่อย",
    "ฉันจะติดต่อ Ariell ได้อย่างไร? ช่วยแชร์อีเมลและโปรไฟล์ LinkedIn ของเขาให้หน่อย"
  ],
  "grounded": "อ้างอิงจากผลงานจริง",
  "sourceNote": "คำตอบดึงข้อมูลมาจากแหล่งข้อมูลพอร์ตโฟลิโอที่เผยแพร่ไว้",
  "privacyButton": "ความเป็นส่วนตัวและการทำงานของระบบ ↗",
  "newChat": "เริ่มการสนทนาใหม่",
  "conversation": "การสนทนาเกี่ยวกับพอร์ตโฟลิโอ",
  "introTag": "อีกหนึ่งวิธีในการทำความรู้จักกับฉัน",
  "heading": "ผลงานที่ดีเริ่มต้นจาก",
  "headingLead": "การสนทนา",
  "headingEm": "ที่ดี",
  "intro": "สอบถามเกี่ยวกับประสบการณ์ สำรวจโปรเจกต์ หรือดูวิธีที่ฉันรับมือกับความท้าทายต่างๆ เลือกจุดเริ่มต้นด้านล่างนี้ได้เลย",
  "suggestions": [
    {
      "icon": "01",
      "title": "ภาพรวม",
      "question": "เล่าเกี่ยวกับภูมิหลังทางวิชาชีพของคุณให้ฟังหน่อย",
      "detail": "ประสบการณ์และจุดเน้นด้านวิศวกรรม"
    },
    {
      "icon": "02",
      "title": "เบื้องหลังการทำงาน",
      "question": "โปรเจกต์ไหนที่แสดงทักษะทางวิศวกรรมของคุณได้ดีที่สุด?",
      "detail": "โปรเจกต์และการตัดสินใจทางเทคนิค"
    },
    {
      "icon": "03",
      "title": "ความเหมาะสมกับตำแหน่ง",
      "question": "ประสบการณ์อะไรที่เกี่ยวข้องกับตำแหน่งวิศวกรแบ็กเอนด์?",
      "detail": "ทักษะและความสอดคล้องกับบทบาทงาน"
    }
  ],
  "ready": "เชื่อมต่อกับฐานความรู้สาธารณะแล้ว",
  "preparing": "กำลังเตรียมเนื้อหาพอร์ตโฟลิโอ คุณยังสามารถลองเริ่มการสนทนาได้",
  "messages": "ข้อความ",
  "you": "คุณ",
  "assistant": "ผู้ช่วยพอร์ตโฟลิโอ",
  "sources": "แหล่งข้อมูล",
  "thinking": "กำลังค้นหาผ่านแหล่งข้อมูลสาธารณะ...",
  "inputLabel": "สอบถามเกี่ยวกับประสบการณ์ โปรเจกต์ หรือทักษะ",
  "placeholder": "คุณอยากทราบอะไร?",
  "send": "ส่งคำถาม",
  "honesty": "คำตอบที่อ้างอิงจากแหล่งข้อมูล ซื่อสัตย์เกี่ยวกับสิ่งที่ยังไม่มีข้อมูล",
  "enter": "↵ เพื่อส่ง",
  "footer": "สร้างขึ้นจากความอยากรู้อยากเห็น",
  "footerDetail": "ประสบการณ์มนุษย์ อินเทอร์เฟซ AI",
  "close": "ปิดข้อมูลความเป็นส่วนตัว",
  "transparent": "ความโปร่งใสเล็กน้อย",
  "privacyTitle": "อธิบายเกี่ยวกับการสนทนาของคุณ",
  "privacy": [
    "คำถามและบริบทการสนทนาล่าสุดจะถูกส่งไปยังผู้ให้บริการ AI ที่กำหนดไว้ (โดยปกติคือ Gemini) เพื่อตอบคำถามโดยใช้เอกสารพอร์ตโฟลิโอสาธารณะ ผู้ให้บริการจะประมวลผลข้อมูลนี้ภายใต้ข้อกำหนดของตนเอง",
    "แอปนี้จะเก็บประวัติการแชทไว้ในหน่วยความจำเซสชันของเบราว์เซอร์สำหรับแท็บนี้ การเริ่มการสนทนาใหม่จะเป็นการล้างประวัตินั้น แอปไม่ได้จัดเก็บข้อความการสนทนาไว้ในฐานข้อมูลหรือบันทึกของแอปพลิเคชัน",
    "บันทึกการทำงานประกอบด้วย ID คำขอ เวลาที่ใช้ จำนวนโทเค็น และสถานะสำรอง ตัวระบุเครือข่ายแบบแฮชจะถูกใช้ชั่วคราวเพื่อจำกัดอัตราการใช้งาน โปรดอย่าแชร์ข้อมูลส่วนบุคคลที่ละเอียดอ่อน",
    "แหล่งข้อมูลจะแสดงเมื่อมีข้อมูล คำตอบจาก AI อาจมีความผิดพลาดได้ โปรดตรวจสอบรายละเอียดที่สำคัญกับแหล่งข้อมูลต้นทาง",
    "ภาษาอัตโนมัติจะใช้สัญญาณจากประเทศที่โฮสต์ หากไม่สามารถใช้งานได้ เบราว์เซอร์ของคุณจะขอรหัสประเทศจาก ipapi.co ซึ่งจะได้รับที่อยู่ IP ของคุณ ตัวเลือกที่คุณเลือกด้วยตนเองจะถูกบันทึกไว้ในเบราว์เซอร์นี้ ข้อความใน UI อาจถูกแปลโดย Gemini โดยตำแหน่งของคุณจะไม่ถูกส่งไปยัง Gemini"
  ],
  "language": "ภาษา",
  "auto": "อัตโนมัติ",
  "sendError": "ไม่สามารถส่งคำถามของคุณได้ โปรดลองอีกครั้ง",
  "timeout": "คำขอหมดเวลา โปรดลองอีกครั้ง",
  "rateError": "มีคำถามมากเกินไป โปรดลองอีกครั้งในหนึ่งนาที",
  "unavailable": "ผู้ช่วยไม่พร้อมใช้งานชั่วคราว โปรดลองอีกครั้งในเร็วๆ นี้",
  "fallback": "ข้อมูลนั้นยังไม่มีในฐานความรู้สาธารณะของพอร์ตโฟลิโอนี้ ลองคำถามอื่น หรือกลับมาตรวจสอบใหม่หลังจากเจ้าของเพิ่มข้อมูลแล้ว",
  "translationError": "ไม่สามารถแปลอินเทอร์เฟซได้ กำลังแสดงภาษาอังกฤษในขณะนี้",
  "detecting": "กำลังตรวจหาภาษา...",
  "locationUnavailable": "ไม่สามารถตรวจหาประเทศได้ กำลังใช้ภาษาของเบราว์เซอร์ของคุณ คุณสามารถเลือกภาษาอื่นได้ที่ด้านบน",
  "retryLanguage": "ลองใหม่",
  "accessibility": {
    "skipChat": "ข้ามไปยังแชต",
    "skipInput": "ข้ามไปยังช่องคำถาม",
    "opensNewTab": "เปิดในแท็บใหม่",
    "inputHelp": "กด Enter เพื่อส่ง และ Shift+Enter เพื่อขึ้นบรรทัดใหม่",
    "remaining": "เหลืออีก {count} อักขระ",
    "cleared": "ล้างการสนทนาแล้ว",
    "home": "หน้าแรกของพอร์ตโฟลิโอ"
  }
}
