{
  "person": "האדם שמאחורי העבודה",
  "profile": "גלו את המסע שלי כמהנדס תוכנה. חקרו את הפרויקטים, הניסיון וההחלטות הטכנולוגיות שמאחורי העבודה שלי באמצעות שיחות אינטראקטיביות מבוססות בינה מלאכותית.",
  "explore": "שאלות מוצעות",
  "nav": ["ניסיון", "פרויקטים", "מיומנויות וכלים", "יצירת קשר"],
  "navQuestions": [
    "ספר לי על הניסיון שלך.",
    "ספר לי על הפרויקטים שלך.",
    "ספר לי על המיומנויות והכלים שלך.",
    "איך אוכל ליצור קשר עם אריאל? שתף את כתובת המייל שלו ואת פרופיל ה-LinkedIn שלו."
  ],
  "grounded": "מבוסס על עבודה אמיתית.",
  "sourceNote": "התשובות שאובות ממקורות תיק עבודות שפורסמו.",
  "privacyButton": "פרטיות ואיך זה עובד ↗",
  "newChat": "שיחה חדשה",
  "conversation": "שיחת תיק עבודות",
  "introTag": "דרך אחרת להכיר אותי",
  "heading": "שוחחו עם קורות החיים הממוחשבים שלי",
  "headingLead": "שיחה ",
  "headingEm": "טובה.",
  "intro": "שאל על הניסיון שלי, חקור פרויקט, או ראה כיצד אני מתמודד עם אתגר. בחר נקודת התחלה למטה.",
  "suggestions": [
    {
      "icon": "01",
      "title": "התמונה הגדולה",
      "question": "ספר לי על הרקע המקצועי שלך.",
      "detail": "ניסיון ומיקוד הנדסי"
    },
    {
      "icon": "02",
      "title": "מתחת למכסה המנוע",
      "question": "אילו פרויקטים מדגימים בצורה הטובה ביותר את כישורי ההנדסה שלך?",
      "detail": "פרויקטים והחלטות טכניות"
    },
    {
      "icon": "03",
      "title": "התאמה אפשרית",
      "question": "איזה ניסיון רלוונטי לתפקיד פיתוח צד שרת (Backend)?",
      "detail": "מיומנויות והתאמת תפקיד"
    }
  ],
  "ready": "בסיס הידע הציבורי מחובר",
  "preparing": "תוכן תיק העבודות בהכנה. אתה עדיין יכול לנסות את השיחה.",
  "messages": "הודעות",
  "you": "אתה",
  "assistant": "עוזר תיק עבודות",
  "sources": "מקורות",
  "thinking": "מחפש במקורות הציבוריים…",
  "inputLabel": "שאל על ניסיון, פרויקטים או מיומנויות",
  "placeholder": "מה תרצה לדעת?",
  "send": "שלח שאלה",
  "honesty": "תשובות המגובות במקורות. כנות לגבי מה שחסר.",
  "enter": "↵ לשליחה",
  "footer": "נבנה סביב סקרנות.",
  "footerDetail": "חוויה אנושית. ממשק בינה מלאכותית.",
  "close": "סגור מידע פרטיות",
  "transparent": "קצת שקיפות",
  "privacyTitle": "השיחה שלך, מוסברת.",
  "privacy": [
    "שאלות והקשר השיחה האחרון נשלחים לספק הבינה המלאכותית המוגדר (Groq כברירת מחדל) כדי לענות באמצעות מסמכי תיק עבודות ציבוריים. הספק מעבד נתונים אלו תחת התנאים שלו.",
    "אפליקציה זו שומרת את היסטוריית הצ'אט באחסון הסשן של הדפדפן שלך עבור לשונית זו. שיחה חדשה מנקה היסטוריה זו. היא אינה שומרת את טקסט השיחה במסד הנתונים או בלוגים של היישום.",
    "יומני תפעול מכילים מזהי בקשות, תזמונים, ספירות אסימונים וסטטוס גיבוי. מזהי רשת מקודדים בגיבוב (hashed) משמשים באופן זמני להגבלת קצב פניות. נא לא לשתף מידע אישי רגיש.",
    "מקורות מוצגים כאשר הם זמינים. תשובות בינה מלאכותית עדיין עולות לכדי שגיאות; ודא פרטים חשובים מול המקורות שלהם.",
    "שפה אוטומטית משתמשת באות של מדינת האירוח. אם אינו זמין, הדפדפן שלך מבקש קוד מדינה מ-ipapi.co, המקבל את כתובת ה-IP שלך. הבחירה הידנית שלך נשמרת בדפדפן זה. טקסט הממשק עשוי להיות מתורגם על ידי Groq; מיקומך אינו נשלח ל-Groq."
  ],
  "language": "שפה",
  "auto": "אוטומטי",
  "sendError": "לא ניתן לשלוח את השאלה שלך. נסה שוב.",
  "timeout": "פג זמן הבקשה. נסה שוב.",
  "rateError": "יותר מדי שאלות. נסה שוב עוד דקה.",
  "unavailable": "העוזר אינו זמין זמנית. נסה שוב בקרוב.",
  "fallback": "מידע זה אינו זמין עדיין בבסיס הידע הציבורי של תיק עבודות זה. נסה שאלה אחרת, או בדוק שוב לאחר שהבעלים יוסיף את המידע שלו.",
  "translationError": "תרגום הממשק אינו זמין. מציג אנגלית לעת עתה.",
  "detecting": "מזהה שפה…",
  "locationUnavailable": "זיהוי המדינה אינו זמין. משתמש בשפת הדפדפן שלך; אתה יכול לבחור שפה אחרת למעלה.",
  "retryLanguage": "נסה שוב",
  "accessibility": {
    "skipChat": "דלג לצ'אט",
    "skipInput": "דלג להזנת השאלה",
    "opensNewTab": "נפתח בלשונית חדשה",
    "inputHelp": "Enter לשליחה; Shift+Enter לשורה חדשה.",
    "remaining": "{count} תווים נותרו",
    "cleared": "השיחה נוקתה.",
    "home": "עמוד הבית של תיק העבודות"
  }
}
