{
  "person": "工作背後的那個人",
  "profile": "了解我身為軟體工程師的成長歷程。透過與 AI 互動對話，探索我的專案、經歷，以及作品背後的技術決策。",
  "explore": "推薦問題",
  "nav": ["工作經驗", "項目經歷", "技能與工具", "聯繫方式"],
  "navQuestions": [
    "請介紹一下你的工作經驗。",
    "請介紹一下你的項目經歷。",
    "請介紹一下你的技能和工具。",
    "如何聯繫 Ariell？請分享他的電子郵件和 LinkedIn 個人資料。"
  ],
  "grounded": "基於真實工作內容。",
  "sourceNote": "回答均來自已發佈的個人作品集來源。",
  "privacyButton": "隱私與工作原理 ↗",
  "newChat": "新對話",
  "conversation": "作品集對話",
  "introTag": "一種瞭解我的不同方式",
  "heading": "與我的 AI 履歷對話",
  "headingLead": "一場好的",
  "headingEm": "對話。",
  "intro": "詢問我的工作經驗、探索某個項目，或瞭解我如何應對挑戰。請從下方選擇一個起點。",
  "suggestions": [
    {
      "icon": "01",
      "title": "全局概覽",
      "question": "請介紹一下你的職業背景。",
      "detail": "工作經驗與工程重點"
    },
    {
      "icon": "02",
      "title": "深入細節",
      "question": "哪些項目最能體現你的工程技能？",
      "detail": "項目經歷與技術決策"
    },
    {
      "icon": "03",
      "title": "潛在契合度",
      "question": "你有哪些與後端工程崗位相關的經驗？",
      "detail": "技能與崗位匹配度"
    }
  ],
  "ready": "已連接公共知識庫",
  "preparing": "正在準備作品集內容。您現在仍可嘗試進行對話。",
  "messages": "消息",
  "you": "你",
  "assistant": "作品集助手",
  "sources": "來源",
  "thinking": "正在查閱公共來源……",
  "inputLabel": "詢問關於經驗、項目或技能的問題",
  "placeholder": "你想瞭解甚麼？",
  "send": "發送問題",
  "honesty": "基於來源的回答。對於缺失的信息會如實告知。",
  "enter": "↵ 發送",
  "footer": "以好奇心為核心構建。",
  "footerDetail": "人類經驗。AI 界面。",
  "close": "關閉隱私信息",
  "transparent": "一點透明度",
  "privacyTitle": "關於您的對話說明。",
  "privacy": [
    "問題和最近的對話上下文會被發送到配置的 AI 提供商（默認為 Gemini），以使用公共作品集文檔進行回答。提供商根據其自身條款處理這些數據。",
    "此應用會將聊天記錄保存在您當前標籤頁的瀏覽器會話存儲中。開始新對話會清除該記錄。它不會在數據庫或應用程序日誌中存儲對話文本。",
    "操作日誌包含請求 ID、時間、令牌計數和回退狀態。哈希網絡標識符會被臨時用於速率限制。請勿分享敏感的個人信息。",
    "來源在可用時會顯示。AI 的回答仍可能出錯；請根據來源核實重要細節。",
    "自動語言使用托管國家/地區信號。如果不可用，您的瀏覽器會向 ipapi.co 請求國家/地區代碼，該服務會接收您的 IP 地址。您的手動選擇會保存在此瀏覽器中。界面文本可能由 Gemini 翻譯；您的位置不會發送給 Gemini。"
  ],
  "language": "語言",
  "auto": "自動",
  "sendError": "無法發送您的問題。請重試。",
  "timeout": "請求超時。請重試。",
  "rateError": "提問次數過多。請一分鐘後再試。",
  "unavailable": "助手暫時不可用。請稍後再試。",
  "fallback": "該信息尚未包含在此作品集的公共知識庫中。請嘗試其他問題，或在所有者添加信息後再回來查看。",
  "translationError": "界面翻譯不可用。目前顯示英文。",
  "detecting": "正在檢測語言……",
  "locationUnavailable": "國家/地區檢測不可用。正在使用您的瀏覽器語言；您可以在上方選擇其他語言。",
  "retryLanguage": "重試",
  "accessibility": {
    "skipChat": "跳至聊天",
    "skipInput": "跳至問題輸入欄",
    "opensNewTab": "在新分頁中開啟",
    "inputHelp": "按 Enter 傳送，按 Shift+Enter 換行。",
    "remaining": "還可輸入 {count} 個字元",
    "cleared": "對話已清除。",
    "home": "作品集首頁"
  }
}
