{
  "person": "UMUNTU OSEMVA KWOMSEBENZI",
  "profile": "Thola uhambo lwami njengenjiniyela wesoftware. Hlola amaphrojekthi ami, ulwazi, kanye nezinqumo zobuchwepheshe ezingemuva komsebenzi wami ngezingxoxo ezisebenzisanayo ezinikwa amandla yi-AI.",
  "explore": "Imibuzo Ephakanyisiwe",
  "nav": ["Ulwazi Lomsebenzi", "Amaphrojekthi", "Amakhono namathuluzi", "Xhumana"],
  "navQuestions": [
    "Ngitshele ngolwazi lwakho lomsebenzi.",
    "Ngitshele ngamaphrojekthi akho.",
    "Ngitshele ngamakhono akho namathuluzi.",
    "Ngingaxhumana kanjani no-Ariell? Yabelana nge-imeyili yakhe nephrofayela ye-LinkedIn."
  ],
  "grounded": "Kusekelwe emsebenzini wangempela.",
  "sourceNote": "Izimpendulo zithathwa emithonjeni yephothifoliyo eshicilelwe.",
  "privacyButton": "Ubumfihlo nokusebenza kwalokhu ↗",
  "newChat": "Ingxoxo entsha",
  "conversation": "Ingxoxo yephothifoliyo",
  "introTag": "INDLELA EHLUKILE YOKUKWAZI",
  "heading": "Xoxa ne-CV yami ye-AI",
  "headingLead": "ingxoxo ",
  "headingEm": "enhle.",
  "intro": "Buza ngolwazi lwami, hlola iphrojekthi, noma ubone ukuthi ngibhekana kanjani nenselo. Khetha indlela yokuqala ngezansi.",
  "suggestions": [
    {
      "icon": "01",
      "title": "Isithombe esikhulu",
      "question": "Ngitshele ngesimo sakho somsebenzi.",
      "detail": "Ulwazi lomsebenzi nokugxila kobunjiniyela"
    },
    {
      "icon": "02",
      "title": "Ngaphansi kwesivalo",
      "question": "imaphi amaphrojekthi abonisa kahle amakhono akho obunjiniyela?",
      "detail": "Amaphrojekthi nezinqumo zobuchwepheshe"
    },
    {
      "icon": "03",
      "title": "Okufanelekile",
      "question": "iluphi ulwazi oluhlobene nendima yobunjiniyela basemuva?",
      "detail": "Amakhono nokuhambisana nendima"
    }
  ],
  "ready": "Isisekelo solwazi lomphakathi sixhunyiwe",
  "preparing": "Okuqukethwe kwephothifoliyo kuyalungiswa. Usengazama ingxoxo.",
  "messages": "Imiyalezo",
  "you": "WENA",
  "assistant": "USIZO LWEPHOTHIFOLIYO",
  "sources": "IMITHOMBO",
  "thinking": "Kuseshwa emithonjeni yomphakathi…",
  "inputLabel": "Buza ngolwazi, amaphrojekthi, noma amakhono",
  "placeholder": "Yini othanda ukuyazi?",
  "send": "Thumela umbuzo",
  "honesty": "Izimpendulo ezisekelwe emithonjeni. Ngiyethembeka kulokho okungekho.",
  "enter": "↵ ukuthumela",
  "footer": "YAKHIWE NGOKUFUNA UKWAZI.",
  "footerDetail": "Ulwazi lomuntu. Isixhumanisi se-AI.",
  "close": "Vala ulwazi lobumfihlo",
  "transparent": "UKUGCWELEKA KOCINGA",
  "privacyTitle": "Ingxoxo yakho, ichazwe.",
  "privacy": [
    "Imibuzo kanye nomongo wengxoxo yakamuva kuthunyelwa kumnikezi we-AI osethiwe (i-Gemini ngokuzenzakalelayo) ukuze aphendule esebenzisa amadokhumenti ephothifoliyo yomphakathi. Umnikezi ucubungula le datha ngaphansi kwemigomo yakhe.",
    "Lolu hlelo lokusebenza lugcina umlando wezingxoxo kwisitoreji seseshini sesiphequluli sakho kule thebhu. Ingxoxo entsha isula lowo mlando. Ayigcini umbhalo wengxoxo ku-database noma kumalogi wohlelo lokusebenza.",
    "Amalogi okusebenza aququkatha ama-ID ezicelo, izikhathi, izinombolo zamathokheni, nesimo sokubuyela emuva. Izihlonzi zenethiwekhi ezifihliwe zisetshenziswa okwesikhashana ukuze kulawulwe izinga. Sicela ungabi nabelani ngemininingwane yabantu ebucayi.",
    "Imithombo iyabonakala uma ikhona. Izimpendulo ze-AI zisenokwenza amaphutha; qinisekisa imininingwane ebalulekile emithonjeni yayo.",
    "Ulimi oluzenzakalelayo lusebenzisa isignali yezwe elamukelayo. Uma ingatholakali, isiphequluli sakho sicela ikhodi yelizwe ku-ipapi.co, ethola ikheli lakho le-IP. Ukukhetha kwakho ngesandla kugcinwa kulesi siphequluli. Umbhalo we-UI ungahunyushwa ngu-Gemini; indawo yakho ayithunyelwa ku-Gemini."
  ],
  "language": "Ulimi",
  "auto": "Okuzenzakalelayo",
  "sendError": "Ayikwazanga ukuthumela umbuzo wakho. Sicela uzame futhi.",
  "timeout": "Isikhathi sesicelo siphelile. Sicela uzame futhi.",
  "rateError": "Imibuzo eminingi kakhulu. Sicela uzame futhi ngemizuzu.",
  "unavailable": "Umsizi akatholakali okwesikhashana. Sicela uzame futhi maduze.",
  "fallback": "Lolo lwazi alutholakali esisekelweni solwazi lomphakathi sale phothifoliyo okwamanje. Zama omunye umbuzo, noma ubheke futhi ngemuva kokuba umnikazi engeze ulwazi lwakhe.",
  "translationError": "Ukuhunyushwa kwesixhumi esibonakalayo akutholakali. Kuboniswa isiNgisi okwamanje.",
  "detecting": "Kutholwa ulimi…",
  "locationUnavailable": "Ukutholwa kwezwe akutholakali. Kusetshenziswa ulimi lwesiphequluli sakho; ungakhetha olunye ulimi ngenhla.",
  "retryLanguage": "Zama futhi",
  "accessibility": {
    "skipChat": "Eqela engxoxweni",
    "skipInput": "Eqela kokufaka umbuzo",
    "opensNewTab": "kuvuleka kuthebhu entsha",
    "inputHelp": "Faka ukuze uthumele; Shift+Enter ukuthola umugqa omusha.",
    "remaining": "izinhlamvu ezingu-{count} ezisele",
    "cleared": "Ingxoxo isuliwe.",
    "home": "Ikhaya lephothifoliyo"
  }
}
