{
  "person": "کام کے پیچھے کی شخصیت",
  "profile": "ایک سافٹ ویئر انجینئر کے طور پر میرا سفر دریافت کریں۔ میرے پروجیکٹس، تجربے، اور میرے کام کے پیچھے موجود تکنیکی فیصلوں کو انٹرایکٹو AI سے چلنے والی گفتگو کے ذریعے دریافت کریں۔",
  "explore": "تجویز کردہ سوالات",
  "nav": ["تجربہ", "پروجیکٹس", "مہارتیں اور ٹولز", "رابطہ"],
  "navQuestions": [
    "مجھے اپنے تجربے کے بارے میں بتائیں۔",
    "مجھے اپنے پروجیکٹس کے بارے میں بتائیں۔",
    "مجھے اپنی مہارتوں اور ٹولز کے بارے میں بتائیں۔",
    "میں Ariell سے کیسے رابطہ کر سکتا ہوں؟ ان کا ای میل اور LinkedIn پروفائل شیئر کریں۔"
  ],
  "grounded": "حقیقی کام پر مبنی۔",
  "sourceNote": "جوابات شائع شدہ پورٹ فولیو کے ذرائع سے لیے گئے ہیں۔",
  "privacyButton": "رازداری اور یہ کیسے کام کرتا ہے ↗",
  "newChat": "نئی گفتگو",
  "conversation": "پورٹ فولیو گفتگو",
  "introTag": "مجھے جاننے کا ایک مختلف طریقہ",
  "heading": "میرے AI ریزیومے کے ساتھ چیٹ کریں",
  "headingLead": "ایک اچھی ",
  "headingEm": "گفتگو۔",
  "intro": "میرے تجربے کے بارے میں پوچھیں، کسی پروجیکٹ کو دریافت کریں، یا دیکھیں کہ میں کسی چیلنج سے کیسے نبردآزما ہوتا ہوں۔ نیچے دیے گئے شروع کرنے کے مقامات میں سے انتخاب کریں۔",
  "suggestions": [
    {
      "icon": "01",
      "title": "بڑا منظر",
      "question": "مجھے اپنے پیشہ ورانہ پس منظر کے بارے میں بتائیں۔",
      "detail": "تجربہ اور انجینئرنگ فوکس"
    },
    {
      "icon": "02",
      "title": "پردے کے پیچھے",
      "question": "کون سے پروجیکٹس آپ کی انجینئرنگ کی صلاحیتوں کا بہترین مظہر ہیں؟",
      "detail": "پروجیکٹس اور تکنیکی فیصلے"
    },
    {
      "icon": "03",
      "title": "ایک ممکنہ فٹ",
      "question": "Backend انجینئرنگ کے رول سے کون سا تجربہ متعلقہ ہے؟",
      "detail": "مہارتیں اور رول کی مطابقت"
    }
  ],
  "ready": "عوامی نالج بیس جڑا ہوا ہے",
  "preparing": "پورٹ فولیو کا مواد تیار کیا جا رہا ہے۔ آپ پھر بھی گفتگو کی کوشش کر سکتے ہیں۔",
  "messages": "پیغام",
  "you": "آپ",
  "assistant": "پورٹ فولیو اسسٹنٹ",
  "sources": "ذرائع",
  "thinking": "عوامی ذرائع کو دیکھا جا رہا ہے…",
  "inputLabel": "تجربے، پروجیکٹس، یا مہارتوں کے بارے میں پوچھیں",
  "placeholder": "آپ کیا جاننا چاہتے ہیں؟",
  "send": "سوال بھیجیں",
  "honesty": "ذرائع پر مبنی جوابات۔ غائب معلومات کے بارے میں دیانت دار۔",
  "enter": "بھیجنے کے لیے ↵ دبائیں",
  "footer": "تجسس کے گرد بنایا گیا۔",
  "footerDetail": "انسانی تجربہ۔ AI انٹرفیس۔",
  "close": "رازداری کی معلومات بند کریں",
  "transparent": "تھوڑی سی شفافیت",
  "privacyTitle": "آپ کی گفتگو، وضاحت کی گئی۔",
  "privacy": [
    "سوالات اور حالیہ گفتگو کا سیاق و سباق تشکیل شدہ AI فراہم کنندہ (پہلے سے طے شدہ طور پر Gemini) کو عوامی پورٹ فولیو دستاویزات کا استعمال کرتے ہوئے جواب دینے کے لیے بھیجے جاتے ہیں۔ فراہم کنندہ اس ڈیٹا کو اپنی شرائط کے تحت کارروائی کرتا ہے۔",
    "یہ ایپ اس ٹیب کے لیے آپ کے براؤزر کے سیشن اسٹوریج میں چیٹ کی سرگزشت رکھتی ہے۔ نئی گفتگو اس سرگزشت کو صاف کر دیتی ہے۔ یہ ڈیٹا بیس یا ایپلیکیشن لاگز میں گفتگو کا متن محفوظ نہیں کرتی ہے۔",
    "آپریشنل لاگز میں ریکوئسٹ آئی ڈیز، ٹائمنگز، ٹোকن کاؤنٹس، اور فال بیک اسٹیٹس شامل ہوتے ہیں۔ ریٹ محدود کرنے کے لیے عارضی طور پر ہیش شدہ نیٹ ورک شناخت کار استعمال کیے جاتے ہیں۔ براہ کرم حساس ذاتی معلومات کا اشتراک نہ کریں۔",
    "دستیاب ہونے پر ذرائع دکھائے جاتے ہیں۔ AI کے جوابات میں اب بھی غلطیاں ہو سکتی ہیں۔ اہم تفصیلات کو ان کے ذرائع سے تصدیق کریں۔",
    "خودکار زبان ہوسٹنگ ملک کے سگنل کا استعمال کرتی ہے۔ اگر دستیاب نہ ہو، تو آپ کا براؤزر ipapi.co سے ملک کے کوڈ کی درخواست کرتا ہے، جو آپ کا IP ایڈریس وصول کرتا ہے۔ آپ کا دستی انتخاب اس براؤزر میں محفوظ ہو جاتا ہے۔ UI کا متن Gemini کے ذریعے ترجمہ کیا جا سکتا ہے؛ آپ کا مقام Gemini کو نہیں بھیجا جاتا ہے۔"
  ],
  "language": "زبان",
  "auto": "خودکار",
  "sendError": "آپ کا سوال نہیں بھیجا جا سکا۔ براہ کرم دوبارہ کوشش کریں۔",
  "timeout": "درخواست کا وقت ختم ہو گیا۔ براہ کرم دوبارہ کوشش کریں۔",
  "rateError": "بہت زیادہ سوالات ہیں۔ براہ کرم ایک منٹ میں دوبارہ کوشش کریں۔",
  "unavailable": "اسسٹنٹ عارضی طور پر دستیاب نہیں ہے۔ براہ کرم تھوڑی دیر میں دوبارہ کوشش کریں۔",
  "fallback": "یہ معلومات اس پورٹ فولیو کے عوامی نالج بیس میں تحال دستیاب نہیں ہیں۔ دوسرا سوال آزمائیں، یا مالک کے اپنی معلومات شامل کرنے کے بعد دوبارہ دیکھیں۔",
  "translationError": "انٹرفیس کا ترجمہ دستیاب نہیں ہے۔ فی الحال انگریزی دکھائی جا رہی ہے۔",
  "detecting": "زبان کا پتہ لگایا جا رہا ہے…",
  "locationUnavailable": "ملک کا پتہ لگانا دستیاب نہیں ہے۔ آپ کی براؤزر کی زبان استعمال کی جا رہی ہے؛ آپ اوپر کوئی دوسری زبان منتخب کر سکتے ہیں۔",
  "retryLanguage": "دوبارہ کوشش کریں",
  "accessibility": {
    "skipChat": "چیٹ پر جائیں",
    "skipInput": "سوال کے ان پٹ پر جائیں",
    "opensNewTab": "نئی ٹیب میں کھلتا ہے",
    "inputHelp": "بھیجنے کے لیے Enter؛ نئی لائن کے لیے Shift+Enter۔",
    "remaining": "{count} حروف باقی ہیں",
    "cleared": "گفتگو صاف کر دی گئی ہے۔",
    "home": "پورٹ فولیو ہوم"
  }
}
