{
  "person": "ከስራው ጀርባ ያለው ሰው",
  "profile": "እንደ ሶፍትዌር ኢንጂነር ያለኝን ጉዞ ይወቁ። በይነተገናኝ በ AI የተደገፉ ውይይቶች አማካኝነት ፕሮጀክቶቼን፣ ልምዴን እና ከስራዬ ጀርባ ያሉትን ቴክኒካዊ ውሳኔዎች ያስሱ።",
  "explore": "የተጠቆሙ ጥያቄዎች",
  "nav": ["ልምድ", "ፕሮጀክቶች", "ክህሎቶች እና መሣሪያዎች", "ያግኙኝ"],
  "navQuestions": [
    "ስለ ልምዴ ንገረኝ።",
    "ስለ ፕሮጀክቶቼ ንገረኝ።",
    "ስለ ክህሎቶቼ እና መሣሪያዎቼ ንገረኝ።",
    "አሪኤልን እንዴት ማግኘት እችላለሁ? ኢሜይሉን እና የሊንክዲን መገለጫውን አጋራ።"
  ],
  "grounded": "በእውነተኛ ስራ ላይ የተመሰረተ።",
  "sourceNote": "መልሶች ከታተሙ የፖርትፎሊዮ ምንጮች የተወሰዱ ናቸው።",
  "privacyButton": "ግላዊነት እና ይህ እንዴት እንደሚሰራ ↗",
  "newChat": "አዲስ ውይይት",
  "conversation": "የፖርትፎሊዮ ውይይት",
  "introTag": "እኔን ለማወቅ የተለየ መንገድ",
  "heading": "ከእኔ AI ከቀጠሮ ማጠቃለያ ጋር ይወያዩ",
  "headingLead": "ጥሩ ",
  "headingEm": "ውይይት።",
  "intro": "ስለ ልምዴ ጠይቅ፣ አንድ ፕሮጀክት አስስ፣ ወይም አንድን ፈተና እንዴት እንደምቀርበው ተመልከት። ከዚህ በታች የመነሻ ነጥብ ይምረጡ።",
  "suggestions": [
    {
      "icon": "01",
      "title": "ትልቁ ምስል",
      "question": "ስለ ባለሙያዊ ዳራዬ ንገረኝ።",
      "detail": "ልምድ እና የኢንጂነሪንግ ትኩረት"
    },
    {
      "icon": "02",
      "title": "ከሽፋኑ በታች",
      "question": "የትኞቹ ፕሮጀክቶች የኢንጂነሪንግ ክህሎቶቼን በተሻለ ሁኔታ ያሳያሉ?",
      "detail": "ፕሮጀክቶች እና ቴክኒካዊ ውሳኔዎች"
    },
    {
      "icon": "03",
      "title": "ሊሆን የሚችል ተስማሚነት",
      "question": "ለ የባክኤንድ ኢንጂነሪንግ ሚና ምን ዓይነት ልምድ አግባብነት አለው?",
      "detail": "ክህሎቶች እና የሚና መጣጣም"
    }
  ],
  "ready": "የህዝብ እውቀት መሰረት ተገናኝቷል",
  "preparing": "የፖርትፎሊዮ ይዘት እየተዘጋጀ ነው። አሁንም ውይይቱን መሞከር ይችላሉ።",
  "messages": "መልዕክቶች",
  "you": "እርስዎ",
  "assistant": "የፖርትፎሊዮ ረዳት",
  "sources": "ምንጮች",
  "thinking": "የህዝብ ምንጮችን በመመልከት ላይ…",
  "inputLabel": "ስለ ልምድ፣ ፕሮጀክቶች ወይም ክህሎቶች ይጠይቁ",
  "placeholder": "ምን ማወቅ ይፈልጋሉ?",
  "send": "ጥያቄ ላክ",
  "honesty": "በምንጭ የተደገፉ መልሶች። ስለጠፉት ነገሮች እውነተኛ።",
  "enter": "ለመላክ ↵ ይጠቀሙ",
  "footer": "በጉጉት ዙሪያ የተገነባ።",
  "footerDetail": "የሰው ልምድ። የ AI በይነገጽ።",
  "close": "የግላዊነት መረጃን ዝጋ",
  "transparent": "ትንሽ ግልጽነት",
  "privacyTitle": "ውይይትዎ፣ ተብራርቷል።",
  "privacy": [
    "ጥያቄዎች እና የቅርብ ጊዜ የውይይት አውድ በይፋዊ የፖርትፎሊዮ ሰነዶች ተጠቅመው ለመመለስ ለተዋቀረው የ AI አቅራቢ (በነባሪ ጀሚኒ) ይላካሉ። አቅራቢው ይህንን ውሂብ በራሱ ውሎች ስር ያስኬዳል።",
    "ይህ መተግበሪያ የውይይት ታሪክን በዚህ ትር አሳሽ ክፍለ ጊዜ ማከማቻ ውስጥ ያስቀምጣል። አዲስ ውይይት ያንን ታሪክ ያጸዳል። የውይይት ጽሑፍ በመረጃ ቋቱ ወይም በመተግበሪያ ምዝግብ ማስታወሻዎች ውስጥ አያስቀምጥም።",
    "የአሰራር ምዝግብ ማስታወሻዎች የጥያቄ መታወቂያዎችን፣ የጊዜ ሰሌዳዎችን፣ የቶከን ብዛቶችን እና የመመለሻ ሁኔታን ይይዛሉ። ሃሽ የተደረጉ የአውታረ መረብ መለያዎች ለፍጥነት ገደብ በጊዜያዊነት ጥቅም ላይ ይውላሉ። እባክዎ ሚስጥራዊ የግል መረጃዎችን አያጋሩ።",
    "ምንጮች ሲገኙ ይታያሉ። የ AI መልሶች አሁንም ስህተቶችን ሊሠሩ ይችላሉ; ጠቃሚ ዝርዝሮችን በምንጮቻቸው ላይ ያረጋግጡ።",
    "አውቶማቲክ ቋንቋ የማስተናገጃውን ሀገር ምልክት ይጠቀማል። የማይገኝ ከሆነ አሳሽዎ ከ ipapi.co የሀገር ኮድ ይጠይቃል፣ ይህም የእርስዎን IP አድራሻ ይቀበላል። በእጅ የመረጡት ምርጫ በዚህ አሳሽ ውስጥ ይቀመጣል. የዩአይ ጽሑፍ በጀሚኒ ሊተረጎም ይችላል; አካባቢዎ ወደ ጀሚኒ አይላክም።"
  ],
  "language": "ቋንቋ",
  "auto": "ራስ-ሰር",
  "sendError": "ጥያቄዎን መላክ አልተቻለም። እባክዎ እንደገና ይሞክሩ።",
  "timeout": "ጥያቄው አልቋል። እባክዎ እንደገና ይሞክሩ።",
  "rateError": "ብዙ ጥያቄዎች አሉ። እባክዎ በአንድ ደቂቃ ውስጥ እንደገና ይሞክሩ።",
  "unavailable": "ረዳቱ በጊዜያዊነት አይገኝም። እባክዎ በቅርቡ እንደገና ይሞክሩ።",
  "fallback": "ያ መረጃ በዚህ ፖርትፎሊዮ ህዝባዊ የእውቀት መሰረት ውስጥ ገና የለም። ሌላ ጥያቄ ይሞክሩ፣ ወይም ባለቤቱ መረጃውን ካከለ በኋላ እንደገና ይጎብኙ።",
  "translationError": "የበይነገጽ ትርጉም አይገኝም። ለአሁን እንግሊዝኛ እያሳየ ነው።",
  "detecting": "ቋንቋ በመለየት ላይ…",
  "locationUnavailable": "የሀገር ማወቂያ አይገኝም። የአሳሽ ቋንቋዎን በመጠቀም ላይ; ከላይ ሌላ ቋንቋ መምረጥ ይችላሉ።",
  "retryLanguage": "እንደገና ሞክር",
  "accessibility": {
    "skipChat": "ወደ ውይይት ዝለል",
    "skipInput": "ወደ ጥያቄ ግቤት ዝለል",
    "opensNewTab": "በአዲስ ትር ይከፈታል",
    "inputHelp": "ለመላክ አስገባን ይጫኑ; ለአዲስ መስመር Shift+Enter።",
    "remaining": "{count} ቁምፊዎች ቀርተዋል",
    "cleared": "ውይይት ተጸድቷል።",
    "home": "የፖርትፎሊዮ መነሻ ገጽ"
  }
}
