{
  "person": "ЛЮДИНА ЗА ЦІЄЮ РОБОТОЮ",
  "profile": "Дізнайтеся про мій шлях як інженера-програміста. Досліджуйте мої проєкти, досвід та технічні рішення завдяки інтерактивним розмовам зі штучним інтелектом.",
  "explore": "Пропоновані запитання",
  "nav": ["Досвід", "Проєкти", "Навички та інструменти", "Контакти"],
  "navQuestions": [
    "Розкажіть про ваш досвід.",
    "Розкажіть про ваші проєкти.",
    "Розкажіть про ваші навички та інструменти.",
    "Як я можу зв'язатися з Аріеллом? Поділіться його електронною поштою та профілем у LinkedIn."
  ],
  "grounded": "Ґрунтується на реальній роботі.",
  "sourceNote": "Відповіді базуються на опублікованих джерелах портфоліо.",
  "privacyButton": "Конфіденційність і як це працює ↗",
  "newChat": "Нова розмова",
  "conversation": "Розмова про портфоліо",
  "introTag": "ІНШИЙ СПОСІБ ПОЗНАЙОМИТИСЯ ЗІ МНОЮ",
  "heading": "Поспілкуйтеся з моїм ШІ-резюме",
  "headingLead": "хороша ",
  "headingEm": "розмова.",
  "intro": "Запитайте про мій досвід, дослідіть проєкт або подивіться, як я підходжу до вирішення завдань. Виберіть відправну точку нижче.",
  "suggestions": [
    {
      "icon": "01",
      "title": "Загальна картина",
      "question": "Розкажіть про ваш професійний досвід.",
      "detail": "Досвід та інженерний фокус"
    },
    {
      "icon": "02",
      "title": "Під капотом",
      "question": "Які проєкти найкраще демонструють ваші інженерні навички?",
      "detail": "Проєкти та технічні рішення"
    },
    {
      "icon": "03",
      "title": "Можлива відповідність",
      "question": "Який досвід релевантний для ролі бекенд-інженера?",
      "detail": "Навички та відповідність ролі"
    }
  ],
  "ready": "Публічна база знань підключена",
  "preparing": "Вміст портфоліо готується. Ви все одно можете спробувати розмову.",
  "messages": "Повідомлення",
  "you": "ВИ",
  "assistant": "АСИСТЕНТ ПОРТФОЛІО",
  "sources": "ДЖЕРЕЛА",
  "thinking": "Перегляд публічних джерел…",
  "inputLabel": "Запитайте про досвід, проєкти чи навички",
  "placeholder": "Що б ви хотіли дізнатися?",
  "send": "Надіслати запитання",
  "honesty": "Відповіді на основі джерел. Чесно про те, чого бракує.",
  "enter": "↵ для надсилання",
  "footer": "СТВОРЕНО НА ОСНОВІ ДОПИТЛИВОСТІ.",
  "footerDetail": "Людиський досвід. Інтерфейс зі штучним інтелектом.",
  "close": "Закрити інформацію про конфіденційність",
  "transparent": "ТРОХИ ПРОЗОРОСТІ",
  "privacyTitle": "Ваша розмова, пояснення.",
  "privacy": [
    "Запитання та контекст нещодавньої розмови надсилаються налаштованому провайдеру ШІ (за замовчуванням Gemini) для надання відповідей за допомогою публічних документів портфоліо. Провайдер обробляє ці дані відповідно до власних умов.",
    "Цей додаток зберігає історію чату в сховищі сеансу вашого браузера для цієї вкладки. Нова розмова очищає цю історію. Він не зберігає текст розмови в базі даних або журналах додатків.",
    "Операційні журнали містять ідентифікатори запитів, часові мітки, кількість токенів та статус резервного копіювання. Хешовані ідентифікатори мережі тимчасово використовуються для обмеження частоти запитів. Будь ласка, не діліться чутливою особистою інформацією.",
    "Джерела відображаються, коли вони доступні. Відповіді ШІ все ж можуть містити помилки; перевіряйте важливі деталі за їхніми джерелами.",
    "Автоматична мова використовує сигнал країни хостингу. Якщо він недоступний, ваш браузер запитує код країни з ipapi.co, який отримує вашу IP-адресу. Ваш ручний вибір зберігається в цьому браузері. Текст інтерфейсу може перекладатися Gemini; ваше місцезнаходження не надсилається до Gemini."
  ],
  "language": "Мова",
  "auto": "Авто",
  "sendError": "Не вдалося надіслати запитання. Спробуйте ще раз.",
  "timeout": "Час очікування запиту вичерпано. Спробуйте ще раз.",
  "rateError": "Забагато запитань. Спробуйте ще раз за хвилину.",
  "unavailable": "Асистент тимчасово недоступний. Будь ласка, повторіть спробу незабаром.",
  "fallback": "Ця інформація ще недоступна в публічній базі знань цього портфоліо. Спробуйте інше запитання або перевірте пізніше, після того як власник додасть свою інформацію.",
  "translationError": "Переклад інтерфейсу недоступний. Поки що відображається англійська.",
  "detecting": "Визначення мови…",
  "locationUnavailable": "Визначення країни недоступне. Використовується мова вашого браузера; ви можете вибрати іншу мову вище.",
  "retryLanguage": "Повторити",
  "accessibility": {
    "skipChat": "Перейти до чату",
    "skipInput": "Перейти до введення запитання",
    "opensNewTab": "відкривається в новому вкладці",
    "inputHelp": "Enter для надсилання; Shift+Enter для нового рядка.",
    "remaining": "Залишилося символів: {count}",
    "cleared": "Розмову очищено.",
    "home": "Головна сторінка портфоліо"
  }
}
