{
  "person": "작업 뒤에 있는 사람",
  "profile": "소프트웨어 엔지니어로서 걸어온 제 여정을 만나보세요. AI와의 대화를 통해 프로젝트와 경험, 그리고 작업의 바탕이 된 기술적 의사결정을 살펴볼 수 있습니다.",
  "explore": "추천 질문",
  "nav": ["경력", "프로젝트", "기술 및 도구", "연락처"],
  "navQuestions": [
    "경력에 대해 알려주세요.",
    "프로젝트에 대해 알려주세요.",
    "기술 및 도구에 대해 알려주세요.",
    "Ariell에게 어떻게 연락할 수 있나요? 이메일과 LinkedIn 프로필을 공유해주세요."
  ],
  "grounded": "실제 작업에 기반합니다.",
  "sourceNote": "답변은 공개된 포트폴리오 자료를 바탕으로 합니다.",
  "privacyButton": "개인정보 보호 및 작동 방식 ↗",
  "newChat": "새로운 대화",
  "conversation": "포트폴리오 대화",
  "introTag": "저를 알아가는 색다른 방법",
  "heading": "AI 이력서와 대화하세요",
  "headingLead": "좋은 ",
  "headingEm": "대화에서 시작됩니다.",
  "intro": "제 경력에 대해 묻거나, 프로젝트를 탐색하거나, 제가 문제에 접근하는 방식을 확인해보세요. 아래에서 시작점을 선택하세요.",
  "suggestions": [
    {
      "icon": "01",
      "title": "전체적인 모습",
      "question": "전문적인 배경에 대해 알려주세요.",
      "detail": "경력 및 엔지니어링 중점 분야"
    },
    {
      "icon": "02",
      "title": "내부 들여다보기",
      "question": "엔지니어링 기술을 가장 잘 보여주는 프로젝트는 무엇인가요?",
      "detail": "프로젝트 및 기술적 결정"
    },
    {
      "icon": "03",
      "title": "적합성 확인",
      "question": "백엔드 엔지니어링 역할과 관련된 경력은 무엇인가요?",
      "detail": "기술 및 역할 적합성"
    }
  ],
  "ready": "공개 지식 베이스 연결됨",
  "preparing": "포트폴리오 콘텐츠를 준비 중입니다. 대화는 지금 바로 시도해보실 수 있습니다.",
  "messages": "메시지",
  "you": "사용자",
  "assistant": "포트폴리오 어시스턴트",
  "sources": "출처",
  "thinking": "공개 자료를 검색 중입니다…",
  "inputLabel": "경력, 프로젝트 또는 기술에 대해 질문하세요",
  "placeholder": "무엇이 궁금하신가요?",
  "send": "질문 보내기",
  "honesty": "출처 기반 답변. 누락된 정보에 대해서는 솔직하게 답변합니다.",
  "enter": "↵ 전송",
  "footer": "호기심을 중심으로 구축됨.",
  "footerDetail": "인간의 경험. AI 인터페이스.",
  "close": "개인정보 보호 정보 닫기",
  "transparent": "약간의 투명성",
  "privacyTitle": "대화 방식에 대한 설명",
  "privacy": [
    "질문과 최근 대화 맥락은 공개 포트폴리오 문서를 사용하여 답변하기 위해 구성된 AI 제공업체(기본값: Gemini)로 전송됩니다. 제공업체는 자체 약관에 따라 이 데이터를 처리합니다.",
    "이 앱은 현재 탭의 브라우저 세션 저장소에 대화 기록을 보관합니다. 새로운 대화를 시작하면 해당 기록이 삭제됩니다. 데이터베이스나 애플리케이션 로그에는 대화 내용을 저장하지 않습니다.",
    "운영 로그에는 요청 ID, 타이밍, 토큰 수 및 대체 상태가 포함됩니다. 해시된 네트워크 식별자는 속도 제한을 위해 일시적으로 사용됩니다. 민감한 개인정보는 공유하지 마십시오.",
    "출처는 가능한 경우 표시됩니다. AI 답변에는 오류가 있을 수 있으므로 중요한 세부 정보는 출처를 통해 확인하시기 바랍니다.",
    "자동 언어 설정은 호스팅 국가 신호를 사용합니다. 사용할 수 없는 경우 브라우저가 ipapi.co에 국가 코드를 요청하며, 해당 서비스는 귀하의 IP 주소를 수신합니다. 수동으로 선택한 언어는 이 브라우저에 저장됩니다. UI 텍스트는 Gemini에 의해 번역될 수 있으며, 귀하의 위치 정보는 Gemini로 전송되지 않습니다."
  ],
  "language": "언어",
  "auto": "자동",
  "sendError": "질문을 보낼 수 없습니다. 다시 시도해주세요.",
  "timeout": "요청 시간이 초과되었습니다. 다시 시도해주세요.",
  "rateError": "질문이 너무 많습니다. 1분 후에 다시 시도해주세요.",
  "unavailable": "어시스턴트를 일시적으로 사용할 수 없습니다. 잠시 후 다시 시도해주세요.",
  "fallback": "해당 정보는 이 포트폴리오의 공개 지식 베이스에 아직 없습니다. 다른 질문을 해보시거나, 소유자가 정보를 추가한 후 다시 확인해주세요.",
  "translationError": "인터페이스 번역을 사용할 수 없습니다. 현재는 영어로 표시됩니다.",
  "detecting": "언어 감지 중…",
  "locationUnavailable": "국가 감지를 사용할 수 없습니다. 브라우저 언어를 사용 중이며, 위에서 다른 언어를 선택할 수 있습니다.",
  "retryLanguage": "재시도",
  "accessibility": {
    "skipChat": "채팅으로 이동",
    "skipInput": "질문 입력란으로 이동",
    "opensNewTab": "새 탭에서 열립니다",
    "inputHelp": "Enter로 전송하고 Shift+Enter로 줄을 바꿉니다.",
    "remaining": "{count}자 남음",
    "cleared": "대화를 지웠습니다.",
    "home": "포트폴리오 홈"
  }
}
